{
    "$schema": "../../pedalboard2/static/library_schema.json",
    "name": "Legacy Pedalboard Library",
    "id": "wamstudio.pedalboard2.legacy",
    "version": [0,0],
    "plugins": [
        "{{HOSTNAME}}/plugins/BigMuff/index.js",
        "{{HOSTNAME}}/plugins/blipper/index.js",
        "{{HOSTNAME}}/plugins/CompressorGuitarix/index.js",
        "{{HOSTNAME}}/plugins/deathgate/index.js",
        "{{HOSTNAME}}/plugins/disto_machine/src/index.js",
        "{{HOSTNAME}}/plugins/DualPitchShifter/index.js",
        "{{HOSTNAME}}/plugins/graphicEqualizer/index.js",
        "{{HOSTNAME}}/plugins/greyhole/index.js",
        "{{HOSTNAME}}/plugins/GuitarAmpSim60s/index.js",
        "{{HOSTNAME}}/plugins/BigMuff/index.js",
        "{{HOSTNAME}}/plugins/kbverb/index.js",
        "{{HOSTNAME}}/plugins/Kpp_fuzz/index.js",
        "{{HOSTNAME}}/plugins/kppdistorder/index.js",
        "{{HOSTNAME}}/plugins/BigMuff/index.js",
        "{{HOSTNAME}}/plugins/Octaver/index.js",
        "{{HOSTNAME}}/plugins/OscTube/index.js",
        "{{HOSTNAME}}/plugins/OverdriveRix/index.js",
        "{{HOSTNAME}}/plugins/OwlDirty/index.js",
        "{{HOSTNAME}}/plugins/OwlShimmer/index.js",
        "{{HOSTNAME}}/plugins/SmoothDelay/index.js",
        "{{HOSTNAME}}/plugins/StereoFreqShifter/index.js",
        "{{HOSTNAME}}/plugins/stonephaser/index.js",
        "{{HOSTNAME}}/plugins/StonePhaserStereo/index.js",
        "{{HOSTNAME}}/plugins/sweetWah/index.js",
        "{{HOSTNAME}}/plugins/temper/index.js",
        "{{HOSTNAME}}/plugins/ThruZeroFlanger/index.js",
        "{{HOSTNAME}}/plugins/TS9_OverdriveFaustGenerated/index.js",
        "{{HOSTNAME}}/plugins/WeirdPhaser/index.js"
    ],
    "includes": []
}