{
    "$schema": "../../pedalboard2/static/library_schema.json",
    "name": "Legacy Pedalboard Library",
    "id": "wamstudio.pedalboard2.legacy",
    "version": [0,0],
    "plugins": [
        "/plugins/BigMuff/index.js",
        "/plugins/blipper/index.js",
        "/plugins/CompressorGuitarix/index.js",
        "/plugins/deathgate/index.js",
        "/plugins/disto_machine/src/index.js",
        "/plugins/DualPitchShifter/index.js",
        "/plugins/graphicEqualizer/index.js",
        "/plugins/greyhole/index.js",
        "/plugins/GuitarAmpSim60s/index.js",
        "/plugins/BigMuff/index.js",
        "/plugins/kbverb/index.js",
        "/plugins/Kpp_fuzz/index.js",
        "/plugins/kppdistorder/index.js",
        "/plugins/BigMuff/index.js",
        "/plugins/Octaver/index.js",
        "/plugins/OscTube/index.js",
        "/plugins/OverdriveRix/index.js",
        "/plugins/OwlDirty/index.js",
        "/plugins/OwlShimmer/index.js",
        "/plugins/SmoothDelay/index.js",
        "/plugins/StereoFreqShifter/index.js",
        "/plugins/stonephaser/index.js",
        "/plugins/StonePhaserStereo/index.js",
        "/plugins/sweetWah/index.js",
        "/plugins/temper/index.js",
        "/plugins/ThruZeroFlanger/index.js",
        "/plugins/TS9_OverdriveFaustGenerated/index.js",
        "/plugins/WeirdPhaser/index.js"
    ],
    "includes": []
}